,message to examine
8820,how is depress relat to educ by ocdemarch 2018 httpswwwoecdilibraryorgdocserver782fc82denpdfexpires1524681896ididaccnameguestchecksum52930ee1865d474ab5ab38ff3483a1f7â â¦
8821,stefsanjati kelseybl4ck allthesedoubt interest mental thank for repli year after battl anxieti depress an eat disord and get the help i need i havent seen them pop up at all but thing can alway chang mayb they are dormant
8822,let play are depress cultur
8823,jab bohat ziada tension aur depress ho to relax honay kay liay kya karna chaiay need suggest
8824,becaus not everyon is the duchess of cambridg excel resourc for postpartum care mentalhealth depress umasscct umassmed umassmed httpswwwumassmededunewsnewsarchives201804lifeline4momshelpsobstetricianssupportwomenwithperinataldepressionâ â¦
8825,life is get in the way of my depress nap
8826,black child drown in depress and can not even talk to their famili
8827,struggl to overcom depress â payment vari by studi up to 500 pinellasâ park httpjobsinpinellascom20180425struggletoovercomedepressionpaymentvariesbystudyupto500pinellaspark5â â¦
8828,the real depress hour the100 pictwittercom1r1z4hriw8
8829,hydrat lagladi this video cure my depress
8830,jagexjd id like to say beat peopl up but that is frown uponi exercis to keep depress at bay so i guess that help with stress too definat relaxinghot bubbl bath a good book loud music and drive with the window down
8831,can i get some depress with sprinkl httpstwittercomsweetsilktaestatus984874349059551233â â¦
8832,it crazi how much ive been abl to accomplish sinc i got rid of my depress
8833,beingadoptedmean i have struggl with depress my entir life sometim i have an easier time than other i am not a rainbow farter i never will be i will never sing onli a posit tune it is about find a way to have purpos enjoy life this is who i am
8834,girlziplock i hear soul cycl can get rid of depress just kid plea dont block me i am total on your side on this one
8835,arellarella ajackielarsen idk whi i think like this but all those stuf up toy would be cover up with tear sweat bo and depress like thank but no thank lol
8836,dont ever forget you didnt love cudi music til you met me sorri he induc the stoner depress but it a beauti lesson
8837,eat like a pig becaus depress
8838,juliasci julia have you research lyme diseas a a possibl more and more lyme patient have depress and anxieti a symptom
8839,depress suck
8840,krassenstein honest i think it wa trump dandruff and he wa tri to be slick whi el would he touch him so much and caress his hand unless some of my other theori are true that might or might not explain melania depress mayb she would prefer he wa gay
8841,scholesylad ffslukaaku sharon should not take a complet break bc our depress fc need him
8842,lifestyl factor and the cours of depress in older adult a nesdo studi httpsonlinelibrarywileycomdoiabs101002gps4889afrâ â¦ via 360 medic
8843,ladi youv got 10 to buy the perfect man emoji smile face with heartshap eyes300 stabl career150 good sex5 post fortnit win on snapchat 1 this isnt a meme plea help4 i have chronic depress plea help200 own a mansion
8844,istrugglewith anxieti depress and ocd it is a daili battl what do you struggl withdepressionsuck depress strongertogeth speakout depressedbutnotdef endthestigma
8845,exercis regular cut risk of depress by 16 studi suggest httpnewsskycomstoryexercisingregularlycutsriskofdepressionby16studysuggests11346264â â¦ pictwittercom4qyir3iknt
8846,real answer from a man who come through the dark of major depress httpowlyjdgt30jfrs4â
8847,you have everyth you needwithin you to win your battl you are stronger than you think and more capabl than you realiz hope youarenotalon mentalhealthawar depress anxieti pictwittercomacl7zpbbwf
8848,whi onlin therapi for postpartum depress is gain momentum httpswwwhuffingtonpostca20171115onlinetherapypostpartumdepressiona23275879â â¦
8849,lucynichol78 realmissanxieti i can see it both way when my depress hit my low selfesteem get even lower but when i feel down about myself my depress seem to enjoy join in to make me feel even wors i think they go handinhand and one make the other wors x
8850,depress i care bare got out of bed
8851,the onli indi genr are puzzl and depress fight medont fight me im goofin
8852,um bitchdepress hit me like a truck today
8853,depress and anxieti are two whole as bitch that i refus to let fw me today
8854,so i got in an elev for 30 minut and now my anxieti and depress ha awoken
8855,avocado boost your serotonin level so eat them is a good way to beat depress
8856,in my behaviour we haveaddanxietybrain fogdepressionirritabilityirr angerisolationmemori lossmood swingsnight terrorspan attackssuicid
8857,i fuck hate those peopl so much those peopl who go i wa depress but then i just start think happi thought and then that cure it cool so you didnt have depress you were just sad for a while
8858,there are mani fail in rais boy main were not alway taught to deal w emot that it ok to feel express pain to admit fault be okay w our shortcom to focus on growth that depress doesnt mean your alon that angermania should never be weapon
8859,whitehous presssec foxnew watch foxnew ha been link to high rate of anxieti and depress ha this happen to you save yourself
8860,gay cultur is depress and music theatr
8861,is it normal to have or have a feel like postpartum depress or am i jst emosht emoji slight frown faceemoji disappoint but reliev face â feel worri
8862,modul of gsk3î²î²catenin signal contribut to learn and memori impair in a rat model of depress relat articl modul of gsk3î²î²catenin signal contribut to learn and memori impair in a rat model of depressionâ¦ httpswwwncbinlmnihgovpubmed29688389doptabstractutmsourcedlvritutmmediumtwitterâ â¦
8863,whi doe depress like exist
8864,i slept for 11 hour and that an excel gaug of how bad my depress is current
8865,there not much an 8 mile depress run cant fixi mean except depress
8866,j cole talk depress marri life and new rapper in rare interview httpsgooglbeyk53â pictwittercomppqwptbfxm
8867,i can feel that depress sessionâ¢ kick in emoji smile face with heartshap eyesemoji smile face with heartshap eye
8868,honoretiy no not realli i mean ya know depress a bitch but nah life good got a job a man friend famili a dog and cat grade are good im great
8869,the day my besfriend move home is when my depress will be cure
8870,everi singl person in the world everi cultur everi languag everi countri know it you are what you eat food doe matter httpswwworganiclivefoodcomnutritionfoodmedicineorganicliverawfoodsbeatcancercellsphpâ â¦ food for the bodi is not enough there must be food for the soul httpwwwseattleorganicrestaurantscomveganwholefoodnaturalfoodsherbsfortreatingdepressionanxietyphpâ â¦ depress food health organ pictwittercomnlj5b3jki5
8871,my depress be have me out here hate everyon and everyth shit aint fun
8872,abraham lincoln suffer from depress he wa scare to carri knive becaus he wa afraid hed kill himself
8873,imagin god whisper in your ear let you know everyth that is happen is gone everi sin everi mistak everi failur depress gone all gone
8874,he did care about her depress and ptsd but he wa a teenag not a train psychologist he wa do his best with what ina â i know he a gemini and we dont know how tf to comfort peopl that whi they werent right f httpscuriouscatmeswiftlyheatonxpost4299654991524681522â â¦
8875,i would like to see a dystopian ya novel in which a technolog privileg societi make person autonomi the highest valu lead to cultur polar the fragment of communiti and a huge rise in depress and econom inequ oh wait
8876,shoutout to depress for hit me like a brick your a true one honest can alway count on you to make me in a shit mood
8877,everyon ha a war go on insid of them between happi and depress just some peopl happi is win and other depress is win and some peopl the war is constant chang
8878,depress 0beck 1
8879,tasoffici i realli miss xyz sinc 2016 i have post anim depress and it the most longest pad i ever have
8880,leeratow23 it doesnt have to be a solo battl when you beliv god is with you onli god can deliv you from depress and give you the peac you need
8881,i dont know how to go through this a lost in my famili ha happen with me go under depressionemoji pensiv face
8882,vapor funk cure my depress
8883,thread of vine that cure my depress pictwittercom9ak2f5ryoo
8884,i use to eat noth but process food had between 510 energi drink a day to combat the amount of weed i wa smoke i hate my job hate my flatshar selfmed my depressionanxieti with anyth that trigger dopamin im glad to have put that behind me emoji victori hand light skin tone
8885,rememb when your mom said eat all that junk food wa go to make you sick well she wasnt wrong anxieti depress mental disord are realli gut biom disord loveyourbiom httpswwwbbccomnewshealth43815370â â¦
8886,at the point where im legitim piss when i scroll thru ig and dont see raunchi shit sure your selfi are great and i love all of your pet but where are the meme about as eat and depress that the truli relat content i crave
8887,to handl the loss of a mother httpwwwdebrapasquellacom201804tohandlelossofmotherhtmlspreftwâ â¦ grief god cancer depress anxieti isol pictwittercomtt7spj7qmg
8888,foxnew depress is a messag not an ill let you know that you must chang the way you are made to think by bring god back the right wayse httpkillingevilcomâ start to preview reduc mental ill suicid highest in 30 year psychiatri ha no clue
8889,luvmentalhealth adamhoward2000 seriouslyppl are so judgement what make himher an expert on your depress or ill
8890,if your abl to pull yourself out of depress then that great but dont make it seem like what work for you will work for everyon boo mental ill and how ppl cope with them are on too big of a spectrum to even believ some bullshit like that
8891,wow imagin me without time manag and concentr issu minor anxieti self diagnos depress and deplet heath problem from unhealthi eat habit emoji reliev face
8892,life is realli depress depress
8893,theroyalkourt hey congratul on defeat your suicid ideat and sever depress stay strong and keep fight through it all also congratul on the intern and that 40 ballinemoji basketbal
8894,tesonlin soooooo i hate to be upfront about it but it my birthdayyyyy ani chanc of you put the unicorn in the crown store for a day just to celebr it im im in day 6 of depress realiz i miss my chanc to get one emoji loud cri face
8895,epolekoff ive heard peopl are get entir unrel recommend now like new aaa shooter becaus you like indi puzzl depress gx or whateverbut hope real relat stuff will slide in there
8896,i took a depress nap i want to continu sleep imso
8897,depress ha me good today feel down about most thing feel like everyth i do is for someon el and a wast of my time bc it goe unnot and unappreci i know youv been there too mentalhealth
8898,j cole talk depress marri life new rapper in rare interview httpsgooglfbpwnnuyâ
8899,that what becaus of this tweet i now know you have no idea what the hell depress actual is this is liter so incorrect it not even funni httpstwittercomayanatheoraclestatus988862996247203841â â¦
8900,shyandquiet most depress i onc read occur when we have a felt need to make a decis or solv an issu we may not realiz it at the time
8901,ok so like how am i suppos to tell my mom i have depress without her cri and get mad
8902,clinic depress httpdepressionhealthomnicom20120830clinicaldepressionâ â¦ pictwittercom6unnm95qoq
8903,best option for the depress treatment depress httpbitly2qzsnlcâ
8904,been feel this way for some year now mom deal with a lung diseas and depress been kick my as and im tryna impress peopl that bare pick up the phone and ask me how im do shit wild jcolenc pictwittercomcwvifkqdub
8905,how to fight depress and loneli crime doc thank golden state scum now im all watch horrif thing becausei never know whi but murder show allevi anxieti and depress mayb becaus it make me feel like a detect or mayb i just miss robert stack
8906,perfect threesom rcb depress rcbian
8907,oh no my depress bend over seduct to pick up depressionbend over seduct to pick up depress
8908,dlbreidenth oh definit my depress stem from medic condit and when i help those w dietexercisemedsetc and practic mind i feel so much better oppos to when im in a mood and mindset of life suck life will alway suck it a balanc act forsur
8909,most charcter fight some danger villain who will destroy the world and end itmi charact fite depress and cupid
8910,fight depress is realli vex
8911,httpwwwzavczzavenâ if you feel like end your life tri zav it a veri good programm to teach you how to write use all ten finger it better than a razor so if your fight depress i know you dont wan na do anyth but this is a good way to end the pain
8912,it so hard to move on when you have depress
8913,depress suck suicid thought too i understand these feel so let all help by share the suicid hotlin 18002738255 itll get better i know right now it doesnt seem that way i get it i live this everi singl day depressionisr
8914,give a read to this great inkheist guestpost depress writerslif from toddkiesl httpsinkheistcom20180425placingyourhandintothevoidbytoddkeislingâ â¦horrorbookshelf shanedkeenehorror pictwittercompb9m9nvotb
8915,lack of sexual interest is a symptom of depressionm that explain sooo much
8916,have you tri be posit no i actual thought my depress wa fuel by posit so i havent tri it yet
8917,kathyeasterbro1 emoji weari face depress not let me do this but i promis i am tri
8918,pillowfort by depress remov all self restraint and longterm plan due to the inabl to pictur a futur beyond what direct in front of you
8919,whi do peopl welcom depress in their live like it a cool thing to be depress and when they are depress they want to includ u in their aura of depress emoji neutral face
8920,check out heart of love evolut surviv depress httpamznto2spifnmâ depress is the give up of hope the belief that no one care for you and the thought that suicid is the onli way out yeg yyc yvr
8921,fffssss depress szn httpstwittercomhalfadamsstatus989205838886776833â â¦
8922,mental ill is not a uniform experi it not a cut and dri a monopolar depress it get gnar and it get ugli and peopl get hurt you dont get to claim the stigma of it and turn around and join in the mockeri of other suffer right with you
8923,i genuin want to drop out of school or at least take a semest off im not abl to turn thing in or go to class becaus of my depress and how my medic have fuck me up
8924,selftitledebut i am depress
8925,dont let your thought in quiet place determin your mood becaus you could be wrong depress onli come when your not activereject onli come when your not on your shit stay consist on your shit and dont come back to the internet to refresh or check shit
8926,what do i hold onto onc the depress fade away
8927,saspott raykk ive read about this the worst ive had wa depress on holiday when i couldnt work out proper for two week in a row it wasnt a hectic a your situat though for me rest wa a import a the work out to achiv my goal
8928,jacobreesmogg if also an act of self harm brought by the depress of 6 year of torus auster but an act of self help can get u out of this brexit mad
8929,pla2m front row gravur membersback row depress
8930,homiebirdo depress
8931,im pretti sure that call depress httpstwittercomlexstaylitttstatus989024918778953728â â¦
8932,either i have a smidg of depress or ive hit that lost 20 phase
8933,clinic depress is the 1 global lead caus of disabl
8934,gentlemanjervi small question are you alreadi get medic help for depress becaus i did the same today
8935,fawfulfan aecpa adreanainlb mairinmurphi and what about the suffer of other aapoc peopl who arent all set up for the depress and pain trump is land on u onli care abt blk ppl finehow abt vote in their best interest
8936,nanci is the one who didnt give a fuck about steve the entir year they were togeth steve right didnt want her famil â exact she didnt give a fuck about him becaus he didnt care about her depress and ptsd h httpscuriouscatmeswiftlyheatonxpost4298270911524679856â â¦
8937,i hate depress
8938,ajackielarsen nemosanartist highwatermark not everyon ha the capac to immedi understand all materi taught to them everyon ha their strength and weak and the stress from deal with someth that a person isnt general good with can be overwhelm also depress suck and caus cri
8939,how you look at all the incom freshman excit to be in colleg know they have no clue they join the depress debt club emoji face with tear of joy pictwittercomdypecfx580
8940,i have learn that it is okay to talk about my depress
8941,me at the doctor think abt how to tell the doctor idk how much my med have been do to help my depress v how much it is that ive just been distract by my retribut excit and that overcom my daili self loath and bad thought
8942,me and my depress calm down and chill after i take an anti depress pictwittercom13cwwchdsc
8943,need a friendk jb main u se naraaz houn to wo khana chor de mari mari phire depress main chli jae aur dp b remov kr le
8944,bradleysanborn depress is a myth
8945,save the date may 8th 1130 am pdt we are involv in a new webinar for the inland empir breastfeed coalit depress breastfeed the impact of oxytocin and stress regist here httpowlyidco30jsc3mâ breastfeed lactat httpowlyidco30jsc3mâ
8946,im enter in depress i will never look this good emoji sleepi face httpstwittercomdiorsbitchstatus989203462310301696â â¦
8947,is it ethic for a sport coach to question a player medic decis includ one involv anxieti or depress
8948,my parent were not veri attent my mom ha anger issu and depress she wa abus a a teenag she lost her job when i wa 15 and bare came out the room my dad wa justidk he got le present a i got older especi after they divorc
8949,alibabaotu lololol your mom ha good theori xddd i hope you can manageovercom your depress we dont have much privileg to let depress consum u but work it slowli at your own pace d
8950,tanejamainhoon trishabshetti thank you for enliv a troubl and ravag mind even i am have one like iti should say i am never been stigmat but i have been fight with depress for the past so mani year which is at it nadir now thank trisha for all your input debat
8951,jordi110398 depress strike again
8952,depress is so weird becaus when you experi a good feel it also so strong and it get overwhelm
8953,it raini and i love rain but rain like trigger my depress so i feel like shit rn
8954,proceed from may 12 dreambuild ball support innov at virginiamason like volunt companion program in this donorfund program volunt visit patient listen and show compass to combat loneli and depress for admit patient httppbyndco2v6grâ
8955,could one puff of cannabi ea depress medic news today httpsapplenewsar5pmtb6fpkskphlymrtzzqâ â¦
8956,i dont understand just becaus someon did self analysi and decid to preach posit and conscious suffer from depress smhemoji smirk face httpstwittercomnkanyezikubhekastatus989197031129407489â â¦
8957,did you know 1 in 4 child between 1318 suffer from anxieti a report by the anxieti and depress associ of america pictwittercomyqyng3wtiz
8958,agre i wa bulli relentless after i came out to the point i had to leav my secondari school to be home school i develop panic attack clinic depress sever anxieti disord etc thing need to chang httpstwittercomjadeyasqueenstatus989014175065235457â â¦
8959,cazzacookie68 youv probabl alreadi decid what your go to do but im not sure this person actual understand how hard depress is becaus they are tri to make you feel bad for not wish them a happi birthday so but anyway we are alway here for youemoji heavi red heartemoji heavi red heartxx
8960,jaytekz got a lot of thought in my head right now depress is hit me hard right now but im hang in there love you man
8961,kathfishk it not an opinion you fool but fact he deal with an addict on the daili along with bi polar disord with panic anxieti depress have some sympathi
8962,mattshea birth control which by the way ha a onslaught of horribl side effect one of which is depress
8963,did you know sour sop leav have mani healthbenefit includ treat fever infect depress and mani more use coupon save10 at checkout to save an addit 10 dont forget free ship over 2500 httpsamazingsoursopcomâ httpsamazingsoursopcomâ
8964,lilibthl you fight your depress pictwittercomqnmsdrodqr
8965,my mother put me in this world know that life is hard n jink i blame that bitch for all my depress
8966,dp ha spearhead a huge initi to spread awar about mental health talk about her own depress help in era the stigma associ wdepress but yeah bitter aish fan aish achiev are be duplic by dp pc i get that yall are threaten httpstwittercomtasnimaktasticstatus989133332750446593â â¦
8967,and the great depress
8968,kaitoconnel aaaaayyyyy momma you trynna take a depress nap later
8969,big shoutout to depress and anxieti for be there when no one wa
8970,postbook depress book withdraw or whateva ya call it emoji loud cri face
8971,be outsid can improv memori fight depress and lower blood pressur â here are 12 scienceback reason to spend more time outdoor httpdlvritqqmfw8â pictwittercomzftdxskbb9
8972,i consid myself to be a veri strong mind individu ive gone to my lowest point idk how other would handl it i would hate for ppl to go through depress anxieti or ani other mental issu alon
8973,malloryk well he an idiot he doesnt see the real you like i do i see a great smile a win person and a shine heartand a femal engin to boot yes you are frazzl with depress but peel back the onion and there is noth to laugh at just beauti insid out
8974,can chang in your diet cure your depress httpowlym6bk30jdkqiâ httpowlym6bk30jdkqiâ
8975,could one puff of cannabi easeâ depress httpviralspeciescomcouldonepuffofcannabiseasedepressionâ â¦ pictwittercomz185urghu9
8976,kudo to michael phelp for break the stigma around talk about depress suicid httpswwwcbsnewscomnewsmichaelphelpsrevealshesufferedfromdepressionthoughtaboutkillinghimselfafterolympicsftagcnm0010aac3aâ â¦
8977,could one puff of cannabi easeâ depress httpviralspeciescomcouldonepuffofcannabiseasedepressionâ â¦ pictwittercomhxasdjg5mm
8978,could one puff of cannabi easeâ depress httpviralspeciescomcouldonepuffofcannabiseasedepressionâ â¦ pictwittercomo1v7mknpkl
8979,i can go to the mental institut to get my diploma under depress mind lol
8980,i ad a video to a youtub playlist httpyoutube7luyt6eanbaaâ her last word depress base
8981,me im gon na clean my room so i can feel better about myselfm haphazard shove all the cloth from my depress chairâ¢ into the drawer
8982,noth like your crippl anxieti and depress build til you cri in front of your instructor
8983,spread awar about depress and share her own struggl with it is one of the reason whi she wa includ on the list obvious shes go to continu talk about so ignor peopl like you stop see it a a joke
8984,tanejamainhoon trishabshetti so awesom to see this happen in india final i know exact how it feel a i have been struggl with depress for 18yr now continu to so it is frustrat when famili friend dont get it that watch a funni movi will get me out of depress emoji neutral face
8985,fight your depress with product
8986,depress is real idnt wan na be here
8987,depress mental ill is not a stigma take medic to fix it is not a stigma some peopl need it dont be afraid to tri it to tri someth you deserv to be the real you just like i do im still tri to figur out who i am now im excit to do it 2223
8988,theintercept is there anyth that isnt just outright fraud in this countri anymor the generat that surviv the depress and defeat fascism are so proud im sure
8989,mikalaaaaaaaa weed help my depress tho emoji man shrug medium skin tone
8990,i let this depress and anxieti rule me i let it affect my write push me into a corner blame everyth and everyon one for my failur my lack of progress and work except the one thing that wa realli caus it me it wa too much for too long so i spoke 1623
8991,i like the idea of colleg in theori other than the shit grade depress debt and competit shit lit
8992,we emoji heavi red heartbori gentlegi hopecharityproject emoji rais hand with finger splay medium light skin toneemoji heavi red heartemoji rainbowemoji dragonholdonpainend depress anxietyâ¦ httpswwwinstagramcompbiajjsyhwb0â
8993,nerdonabudget this is whi i have depress emoji pout face
8994,whi hasnt the depress groan been ad to the diagnost criterion i mean 247 im justughughuuuughhhhhhhhhhhuuuuuuuughuuuuuuuuuuuuuuuuuuugh
8995,thread a few month ago i took step to address my mental health i think ive known for a long time that ive had anxieti and depress issu i just chose to ignor them to lean into them to just turn my nose up at them like i wa superior somehow i wasnt im not 123
8996,a video of my new invent 20 twenteacanc diabet dementia depress brain heart liver diseas eyesight httpyoutubezpqrsablkc8â
8997,daultrabeast i am realli realli reallyyyyi scare that im go to have postpartum i hope not tho at least me be paranoid about it mean i wont be in denial and will get help if depress hit
8998,tri to keep up with social activ even if you dont feel like it itll help with depress
8999,russetwolf i had a fall out with a ship partner becaus they pull me into a depress by constant say i wa leav them or they want to delet so i drop them i flip he account i ship with them on and they got someon to make the same charact toâ
9000,anxieti so real and depress too emoji face with cold sweat
9001,fall into a depress and it so easi to dokeepingthefaith
