,message to examine
0,just had a real good moment i miss him so much
1,is read manga httpplurkcompmzp1
2,comeagainjen httptwitpiccom2y2lx httpwwwyoutubecomwatchvzogfqvh2me8
3,lapcat need to send em to my account tomorrow odd i wasnt even refer to my tax those are support evid though
4,add me on myspac myspacecomlookthund
5,so sleepi good time tonight though
6,silkcharm re nbn a someon alreadi said doe fiber to the home mean we will all at least be regular now
7,23 or 24ï¿½c possibl today nice
8,nite twittervill workout in the am ciao
9,danann night darlin sweet dream to you
10,good morn everybodi
11,final i just creat my wordpress blog there alreadi a blog up on the seattl coffe communiti httptinyurlcomc5uufd
12,kisha they cnt get over u til they get out frm under u just rememb ur on top
13,nicolerichi yes i rememb that band it wa awesom will you plea repli
14,i realli love reflect and shadow
15,blueaero ooo it fantasi i like fantasi novel will check it out
16,rokchic28 no prob i sell noth other than my blog httpsnedwancom ill have to get a listen to your band on itun
17,shipovalov quotnokla connect peoplequot
18,onc again stay up to late and have to start too earli it is a good thing i like my job
19,kalpenn i just read about your new job congratul that fantast
20,havent been abl to sleep at all i think ill watch ugli betti onlin
21,woo thank ron and steev for follow me yeow i have folowerssss haha p i wan na got to the ellen show
22,aidenchan yeah sure but it my sister so take extra gd care
23,sianthemous yay a duck if i want anyth watch me itd be a duck lol
24,smaaack that as hahhahahaa i make myself laugh oooooh sleeeep ahha gniit
25,woo it late haha goodnight twittervers xoxo
26,look forward to the meet with pastor kong and jw later
27,doubleickey u know those minichocol in the shape of liquor bottl with liqour insid em
28,test to see if twitter work thro facebook
29,night babi got a vh1 thing in the am check out my pic httptwitpiccom2y57u httptwitpiccom2xzl1 httptwitpiccom2y5s2
30,got the magic number and is thank yall for the support
31,it cold man am i love this weather
32,ok guy weve offici launch new languag swedish and russian realli fun if you ask me wwwsurveypiratecom
33,the ladi who bought the bracelet pictur a my twitter page background is still wear it a week later hasnt taken it off like it
34,dwanb i ate filet american this morn and i cant see your pic on mobil twitter
35,book my hair appoint
36,my report wa english b modern histori a geographi b math b b account a and ipt a
37,dtphulp lol me too you do know that the sound of your voic is great we onli need to do some euh finetun
38,cupcak heaven httpilovecupcakescoza check out the shop nice design weird contact info popup tho
39,bought the mh bundl creat a task call quotmarioquot or quotstar warsquot in quotth hit listquot make sure your sound is on and complet the task
40,someon turn on the shower plea
41,frumousm yeah there are so mani of u angri feeter tim that good lol i have been good i go on i just havent post for a while
42,carly109 love the new song and the chorus is real nice and catchi gud job who did the track and record jordan
43,tayjasp alrit thanxx
44,889grapevin look forward to the new websit
45,modejunki awww sweet but he still a cuti
46,rowanberri ohhh send load of posit vibe your way
47,tcouto cool stuff
48,celebr a minor bank triumph that bank with a b got one to admit it wa wrong
49,cosmicgirli think of you everyth cross turn babi turn
50,emmalight id forgotten about that we need to do that again sometim
51,tommcfli eclips is awesom it better than new moon
52,tire today drunk husband to be roll in at 1am with bunch friend for anoth drink noisi lot
53,ingoramm well it is definitelli worth tri youll notic the differ but it not my favorit neither
54,mileycyrus good morn miley
55,finish my first shift and door are open alreadi
56,noth quit like find good amp set from a solid state amp
57,geelo is it paid i wa made redund two week ago and need a job big time
58,watch the steam train go back and forth in ravenglass sunni
59,natski how bout some steppenwolf magic carpet ride
60,shannanstedman haha maxxi beat whippet
61,yaaaaay jac is train my sorcer to level 35 that mean ill be pwn soon
62,my doggi is so cute
63,nicharri tell her simon quotwho use to be from tuk fmquot say hi
64,wildstarb happi rezday captain and that wa quit a parti
65,this car is cost me an arm and a leg but it so cute i have to forgiv it
66,tweet from cracker barrel
67,whatamysaid phillip schofield the schofe he a legend ami you need to follow him he on my page
68,is about to check out his new techno record from juno
69,rln49 too funni
70,i have to go now make up duti for tomorrow goodnight to all
71,starrgazr yes mam there noth like start the day with a good song and a few danc move
72,go to paint my nail then get some foood
73,is in athen
74,pjakob a in someon would figur out how to access the mp3s without actual pay for them
75,tootholog oh crap im sure they wont dare charg for custom care in india though
76,is handmad good at the moment xxx
77,imasadgiraff browni are good ani time of day
78,check myspac while look at band from differ state so i can add them a friend on myspac i love music
79,happi birthday to my grandpa he ha 3 cat but i still love him
80,fiction your nose is clog use a plunger then
81,inque54 huy matulog ka na hahah cbroom aint done yet but it take shape
82,adamseo it couldnt have come at a better time
83,2 day of school left this week and im beyond excit for saturday
84,just a simpl girloatm make me realli happi in the morningand the bloom wisteria
85,beverleyknight im fine thank you keep be beauti alway
86,aplusk that beauti what a love thing to say
87,dougiemcfli chang your name to michell
88,starboy yay well dont i feel spesh
89,anoth year older today at least it sunni out
90,kduros yep but we fought back well think it will turn out to be the decis moment in win the leagu again though
91,louis thank ive live in florida sinc 1994 and i miss snow
92,goin abroaaaaad tomrow dubaiiii cant wait so long twitter i onli have room for prodigi sorri peep
93,melindsey lol he ha no shame
94,urbanfli do y mean mc escher the painter not the dj
95,i wish school wa like those revis session class of 10 in nonuniform abl to have a laugh and learn at the same time
96,nothin like a good book and some spring clean httpwwwmrsdlightfulcom200904foodstorageandpantrycleaningtipshtml
97,kerryn8 thank appreci your feedback
98,im listen music
99,mileycyrus hi mileeey my friend and i cant wait to your come to spain we are so excit we love all of your song all are great
100,robotsarecool anoth big tabl touch screen woot httpwwwtuawcom20090407illusionlabsgoestothebigscreen
101,nikhilnarayanan no no you are mistaken my uncl is the pm of angamali ani of these antwic there and you are gone case shavam
102,jptoto caus we dont have gem
103,the offici result came out pr won 2 seat wherea bn onli 1 seat congratul pr
104,glove thx for the advic we are just wait for the petosin to kick in
105,im play hooki from work today my voic is realli gone tho so im home today
106,i love spontan road trip
107,id love to tweet all day today but i have work to do that must get done so ill tweet when i can god bless everyon tcot
108,pepperfir is it friday yet how are you babi tweepletuesday followfriday
109,am take advantag of the sunshin and am go to take the dog on the beach for a walkno work for 12 daysyipeeee
110,still employ no troubl there it other stuff that not a sweet
111,let see how well this 25 hour of sleep hold me today i predict a massiv slowdown by 1430 that should be funni
112,came back from see 17 againn wa gooddd lt3
113,superhooti mayb just mayb
114,kimkardashian sooo i just watch disast movi absolut hilari ur my idol
115,kvanduyn i am happi you and mandi had a safe trip i have never been to va beach enjoy
116,jmacgirl1992 id sign up for the extra credit
117,fall asleep here so goodnight everyon
118,hwork ive been live in twitter api land for too long over there we call it the oauth button httpbitly70yrh
119,me and my mate are gunna chekk out a movi next weeki realli want to see the boat that rock
120,bananaanna2008 mikequad i total agre with you anna
121,worde follow u so we can contact you
122,i love a good book
123,with my sister from anoth mister kayla
124,i will be the sun in your sky i will light your way for all time promis you for you i willll
125,betty822 that sound like a pretti good night to me
126,accord to the roster this hockey season wont be so bad after all hah
127,happi gilmor is on
128,nickcart lmao i guess it onli friday my bad
129,waynenh i wish i wasnt follow you so i could be your 1000 follow wayn
130,time for a shower and french toast no not togeth
131,myucan91 daamnn im not even go to ask if it wa boringcom to hk
132,today is thunder over louisvill the start of the derbi festiv i love be here for the festiv even if im not go
133,good mornin folk i think ill make a coupl of home made egg mcmuffin to go with this excel coffe on this clear sunni 58 mornin
134,think that kellan lutz is hot when he smoke
135,okay have torn apart my work fresh coffe amp peanut butter toast then ill tri and put it back togeth again onli le crap this time
136,relax befor guest come hope everyon like the food i know morton wont have made plain rice for him
137,surfislikeaboss me hair aint red it da light it blond and black jamesissexi hey hotti firesti who da other girl
138,today is the day
139,shop queen st in the sun yesterday like the last time for a while i need to find the sf equival of that experi
140,backgammon then a birthday meal for a friend later on
141,donniewahlberg holla just chill on my way to buy some mapl syrup mmm what up with you hope your have a great morn
142,mabelkatz look ok now onli bit and byte clean with hooponopono too
143,azcameron serious busi
144,lllllois you made na your twitter haha d upload a photo updatee
145,linacyrus heyi aww thank so much hun you rock xoxo
146,heidimontag heidiii i love your new singl blackoutamaz i think you dress amazinggg im so jealous haha plea answer someth
147,nubianeagl i wa tempt this morn i random woke up at 530 but i had just fallen asleep after 2 my saniti is more import
148,saidthewhal great photograph saw you guy play at the westjet street parti short set but awesom nonetheless
149,amandabyn i realli like it im ur 1 fan i love all of ur movi especi shes the man it so funni i love it lt3
150,meday right back atchya hope your have a great day
151,just got out of the showerrr myspac
152,is gon na hang out with my two favorit peopl now httpplurkcompovm1q
153,pipe down call bigthang
154,theendtim lmao i love me a good comedi
155,koldcasttv and beautyboutiqu thank for follow
156,realworldmom
157,twitter and look for miley cyrus luv her xo
158,kimkardashian hey kim im a huge fan ur like my role model and i realli hope i can actual meet u one day
159,is go outsid
160,ddlovato oh demi that sure wa a knee slapper
161,is with alyssa
162,mystica43229 hi luv sound like you had a busi day hope all went well
163,watch the bradi bunch
164,go out to the mall onc again
165,mad at tacrain and kylielanejona for complet our mission without me but app wa so good and veri pretti
166,i love the sound of break glass someth veri cathart about it
167,boulder creek with gram
168,mebrownie09 i love you babi
169,gisher im just the retweet i person believ the tweet effect and the week purg will take care of these thing for me
170,ddlovato aw have a safe trip sweeti ill miss you more ox
171,lodurzj well pizza but that is good too
172,qotd quothey i still havent told you guy the stori about the english heritag fella and how he lucki to be still alivequot yawnerddn
173,im still sit here mayb ill go get some air i serious need help my life is almost a clutter a my room
174,nakrissimo can i come i could use a nice decad parti
175,around
176,selenagomez i love you selena gomez your so beauti your my role model and my idol i would be so happi if you repli to me
177,sassycat24 my mommi is here
178,have a beer amp corn dog i know weird combo the santa monica pier
179,clouds2287 hm so i take it the essay are not go so well right now perhap a swap i have noth left to lose lol
180,tweetup afterparti at genji
181,back to work for me twitt yall laterz
182,go to church
183,tehjok yeah now that im done puke crown and coke
184,oliverwalton i know im not normal on here but il though il be cool and see what is happen on the world of twitter
185,and wife are shop at the great mall in milpita great price for u with the dollar still reason low for u
186,goi to reedbox to get some movii
187,sadknob good thing p amp k have their day job
188,capecodgurl and sorri again for spamminghav troubl mash out multisyllab word with my hate finger
189,statesboro fun this am and im off to see the greenjacket in augusta tonight
190,justkelli the fact that you didnt know the librari close at 6 not lame
191,carysss oopssss i forgot to put ypur link at the begin it wa to you haha in case you didnt realis hope your feel better
192,hi loriblue4508 i would suggest music of my electro project httpbitly12kof0 free download amp have fun cheer
193,elicab aw well if u ever feel like fli over 2 con it up ill help u find a place 2 crash i onc flew 2 london 4 a buffi con btw
194,just had a fabul 15 hr run in the desert with missi and kaya and is now off to run some errand befor buffalo burger
195,go old schoolplay super mario brother
196,head down to clear lake to meet ken and other coast guar aux for dinner hope the road are clearnot feel up to row
197,nickypow if your truli addict to twitter you should link your facebook and your twitter togeth updat one and it doe both
198,michaeltyl in most way at least at this rate though i may even bake someth tonight who know
199,kevinmiam thank ill take inspir from today test
200,ladymelancon hey there
201,thethirdrat oh good thankyou
202,im feel veri peac now that my room is clean and ny hair is cut i think im readi for a nap
203,parti it up tonight at j loung in downtown la it a nice sunni day in cali
204,theros when you guy come to washington state you should total crush that tacoma mall plea lol
205,meghanxoxo seth mcfarlen is god
206,vismajor im so glad you guy are have such a wonder weekend
207,goodnight all
208,ohhushmus are you sure bb
209,robynsyk i half taught myself half actual learn viva la vida by coldplayep song
210,sugarhustl hehe u are funni follow me
211,watch ncis is it the grey hair that make mark harmon so attract i think so
212,readi for some patron in hollywood for phathead bday
213,laylakayleigh i have to go skydiv ill let you know next the time im in town
214,sambasel noth
215,talulakim i have the yearbook in the closetil look it up 2moro if u are still curious um where did ki6bjv go to school exactlylol
216,new osalto blog post httptinyurlcomdnbrw3 enjoy
217,blast the across the univers soundtrack
218,angmogirl oh dont worri not gon na be too bad co it a sunday
219,starpadilla lol so i dont realli understand twitter quit yet but i just got your repli to chipotl and that cool
220,billy3g all the cool peopl were herebeforeoprah
221,i had a fun night got to see nevershoutnev and andi from holidayparad yay then waitrewindthat took me to ihop yum
222,oliv long get readi to come on
223,britneyspear i wa at the show last night amaz so glad i wa abl to go
224,zenzie386 yes nyc ha it own way of loveh you httptwitpiccom3ky08
225,respr btw meant to tell you earlier sweet shirt to wear afflicationufc shirt still wait on my cool card to get auth to wear
226,exoticqte u a learn
227,skype is such endless fun
228,bali in juli japan when a good time to go to japan anyon
229,britneyspear thank for follow me back
230,azthunderponi nice i think ill get to sleep so ill have enough energi to enjoy my horsey day
231,just join up cant sleep montu trackday at njmp on the cbr600rr httpwwwnjmotorsportsparkcomtrackshtml thunderbolt
232,dili thank you huge hug
233,fureousangel i recent did a matrix trilog sittingthat wa tire but awesom matrix trilog is my favorit sci fi film stori
234,audballxo total agre with you on beyonc shes stupid ali larter is where it at
235,jimalg dont forget parent often think of their offspr a about 12 yo
236,sophiethecock wardrob are often made of chees so you can eat them
237,went 2 wallyworld today had an awesom time get a kewl easter basket and a nitelit for my comput
238,karencivil okay he just text me say that hed wake up me up lol if he doesnt i call you at 1pm your time thx karen
239,now sleep
240,watch the idnhu vid
241,lizinhollywood cant wait
242,roxxinikki happi birthday take plenti of picsvideo so youll rememb what you did later on
243,good night tonightmi journey on twit end here until tomorrow see ya tomorrow
244,oddessi congrat you are now cooler than me happi birthday miss love
245,night twittz jus came home from parti love it hella tire allerg to cat ew all irrit
246,happi easter everyon
247,janinealino janin whoa dude hahah u realli put the thing i sent u sa fb ahhahage tnx janin
248,neildenni hehe yep i love car boot never usual buy much heh
249,iamdiddi love you diddi diddi live gt httpbitlyben2t
250,ive finish the eat me drink me badg gt httptwitpiccom3l3i1 lt look here
251,just about readi to go to bed it wa a long day today good night
252,authorlisalogan oooh cool cool thank you veri much for that inform
253,knighttim i love you too
254,hannahvictorius we should well organis it proper next time glad you enjoy it
255,tourscotland got it you must be recharg
256,com4mystblgspt thank
257,brob108 good stuff woop look forward to tomorrow have a good day mr brian
258,irish1974 morn irish btw
259,omg i fix my ipod
260,think you should read her real blog wwwlisarcasticblogspotcom it awesom like me lol
261,congratul i hate you
262,ellaeslajirafa quotquotdaiblackish greenquotquotsisilksoquotquot is silk of blackish green colori hope you like it
263,jonathanrknight
264,so both sweetpea and i are back to schoolunivers 2moro realiti bite it been a great break tho feel rejuvin
265,anishaflow thank you my foot and leg are ach but that comment ea the pain
266,walkaboutkiwi i wa in 2l till 3am wait for u kekekek jk
267,anyon care to comment on last night hell kitchen well
268,is about to build a websit
269,watch wizard of waver place lol lol lol
270,of to sacc meet my parent
271,kurioustrina awww thank for call me sexxxyand i thought you forgot about me
272,stare stupid in front of my dad haha he look like einstein
273,yet it you i see wast the dream that onli i deserv ill tear off your face to see your smile lt3
274,good night twitter shit lol im fuuuucckedd hjdjjsiurjhjfhoipwplkjdhjdhhjhjdxdhueuhrjjjjjaaayyyyyyyyyyyi
275,i borrow this from georg httpblipfm4kpxr
276,champagn breakfast bubbl went straight to my head tho lol
277,emc good tri well done with the paint by the way
278,tommcfli welcom home
279,todd saviour goodnight facebook
280,just heard my bootleg remix of quotif u seek amyquot on kiss fm here in chicago
281,stefaniego ahh vampir haha you aint that pale naman ah
282,on the road to my wife 1st triathlon if i do not updat in 6 hr call the paramed
283,gerardway i cant waight till the new albam is out you guy save my life you rock
284,feel like eat an 18 inch pizza from yellowcab can someon give me haha
285,happi sunday to all get readi to go to church i love god so much do u take care friend
286,mummyfitz i am take a dad with me
287,fortheinsan i will tomorrow my comput is off and im on my phone right now
288,heath7 lololol i love a man in ugg
289,ooooo what a chang
290,sammi if your read this you are amaz your my sunshin i love you thank for everyth and i bet you feel the love now haha
291,this night it wa awesom i slept at 1 am i watch kyle xy and supernatur so great
292,kimkardashian kim how are you sorri for the sun burn lol hope your feel good follow me plea big fan lt3
293,lunch over dishwash over im back
294,jonasbroth httptwitpiccom3br5p omj you look hot in everi pic your in i love your new haircut
295,nonafairuz fu and your 200 more follow haha
296,jackfaulkn ah nevermind it the thought that count also quit predict
297,last night wa good watch pearl harbour in elli ben afleck amp whoever play his best mate in it is fit anth fell asleep lmao
298,rachaelphillip we got beaten but le than they were get beaten without me
299,what a love night
300,shaniepa umm through this arrang what would be the earliest day i could get them
301,gourmet i didnt make co i wa one mango short but i wa to use fresh mango theyr in season
302,am home with the famili wet co of the rain got a call from dad on the bus co my mum got worri that i wasnt home yet isnt she sweet
303,madmagz22 hey hun great to see ure on twitter too hope ure well x
304,skinkl yeah right you
305,awak lovin arttm ff5 the main and 30h3 more than ever
306,hethfen great thank you have you been make music good today
307,on our way 2 the airport bye bitch
308,longest sound check ever so long that i have time to type this on stage
309,rosevib well next time then next time
310,anyway sarah prout we all wish you the best of luck and hope you have fun in the process cheer
311,ellemarten i would love to see some of your write i think your a great writer for what i can judg
312,kevinculli make sure you dont take the fun out of fundament
313,it my birthday final 19 woohooooo
314,wonder whi capcom found it necessari to comic increas zangief bulk throughout the street fighter game
315,super tire it too earli to be awak on a weekend king island later
316,my gosh like sayig that it funni gosh haha not the meen just the word it self
317,nickcart httptwitpiccom3knrc okaaay that crazi luv it ermblu omg
318,melraemorgan thank you when i wa younger i use to hate it becaus i wa bulli for be ginger but now i love it x
319,reddic if you wont miss a star trek movi then you are a trekki just not a crossdressingconfer go type lmbo
320,my updat myspac accout love my playlist gt httpwwwmyspacecomsamanthavillanueva
321,raecheybabi im alreadi bounc back no meltdown just catch my breath
322,ashsimpsonwentz hey how are you
323,maron101 is that what were have for breakfast tomorrow
324,olivosartstudio oh i do thing similar to this all the time thank for give it a name i am research it now
325,happi birthday to me
326,spaniard can notic my galician accent when i speak english they find it funni
327,etrangl httptwitpiccom3l8mv mysha amp myreen are so cute
328,peac and sunni
329,is go spend sunday with my famili
330,sofdlovesbsb lol i bet the station will be hear from you alot let hope the singl is red hot
331,or mayb our connect is just so shite that everyon beat me
332,the end is near in sight thank god got a cheeki bit of supernatur on in the background
333,akamonti irish and german there the spunk mix
334,mikeneumann hahaha i know im so uptight thank you handsom xoxoxoxoxoxoxox
335,look for boat rental at lake eufaula for when famili visit ani recommend
336,it my birthday
337,good tranc music gt redbul asot400
338,my first opi d desir prepar to tri it now
339,joeyjepson nice choic anyway i thought mayb you were the artist
340,ever sinc i bought my macbook i send much more email it so fuck easi that i becom a spammer
341,erniehalt welcom back to la congrat on shout out look forward to your resid at hc
342,ryanhawiya yeah i wouldnt care if i wa in a disney channel movi but i realli wan na be in a horrorthril
343,gosh i had not realis how much film studi work pete had set u meanwhil im go to watch the motorcycl diari
344,yes the littlest houseguest is go home today it alreadi turn out to be a great day
345,is excit for her friend date today
346,watch nba playoff coverag my favourit question do the jazz have a chanc against the laker everyon answer so far no
347,violetheverbos men are annoy
348,spend the day with my sister
349,watch footbal again
350,hope everyon is have a swell day
351,dianaduncan just need to be outsid a littl while to get my fix then im fine with glanc out window while i do the puter thing
352,diggin mah new sweater
353,jonasbroth iloveloveloveyou
354,affirmationspot in other word i may just want one for myself when u finish them
355,anyon give away an iphon lol i realli want one anyon generous
356,thank you to all of my new follow i appreci you
357,badbadgirlx good luck with everyth it wa great have you around
358,jonthanjay awesom i have onether some cool game on there
359,get readi to go to a bbq at my babi daddi hous with his wife and our kidscrazi huh peacerockin the bob marley tee and some j
360,chrystinasay cant wait til you come to halifax juli 25 babi got my ticket
361,nicoledeb i dont have much clout but would def give arugul 2 thumb up
362,gojeffrey sweet ride were those the day of the green lizard lol
363,also the inbetween is class
364,deabush lol know what you mean
365,is studi onc again happi 420 everyon xx
366,moonfry that would be my son without a doubt he 12 year old and the air that i breath amp the love of my life
367,take lunch break great rehears
368,crowsond you will have to veri care what your tweet
369,great show the other night excit to do anoth
370,escrov i lovee my sb
371,i wan na write some review of film amp music releas so i go amp leav this place not for a long time of cours
372,kameshvari i thought imogen heap wa a dude the first time i heard her she sing low on that first album
373,jennaglass ahhah i know i want her to follow me toooo
374,chang my email address for old navi newslett and got anoth quotthank for sign upquot coupon awesom
375,fina cut da celli back onn c who all dun texd meden hit up da frenz ampamp c wat it iz fa 2 dayi
376,is tweet for the first time and is watch music channel
377,ddlovato what you think about it we need know if you could go to the parti itll be pretti amaz
378,locaoimh thank you so how are you comfort with your intellig it wa not rhetor onli
