,message to examine
3002,head off to yoga class what a beauti sunshini day
3003,so great to have friend who support the thing you love do feel good love you guy
3004,annasmama0702 thank for tweet my arbonn fc5 eye creme giveaway have a great day
3005,good morn tweet tweet just woke up gon na start get readi for my amaz day call me beep me if you wan na reach me amp
3006,eat at bull realli nice food here
3007,dearangelx oh good im do noth it bore here how bout u
3008,my saturday offic httptwitpiccom697o6
3009,sigi seicha v cafe anton pobeg za chaem v otel a zdes free inet vot i mychaus bez russkogo yazika
3010,wushupork good turnout think theyll have you back
3011,mileycyrus said hello to hk im soooo happi luv her soooo much
3012,ddlovato where are you do your vacat
3013,idador like your new killerheel but dont wear them with sock that a nogo
3014,had a top night out in bristol and recov slowli fryup and cup final will now occur
3015,goatladi garlic is excel in such case 1 from me
3016,tinam the benefit of twitter etc is let me know what your do even though your a bazillion mile away and it all about me
3017,livinthefitlif morn about to get some cardio and lift done at the gym short alway good to see your tweet
3018,jezabel what a nice offer
3019,explos and boob wwwexplosionsandboobscom noth more noth le
3020,unclerush hey russel did you see my christ and yoga rap video
3021,yummy411 not a problem love your display pic
3022,hope thing work out
3023,graut yah itwork around 7 pm i will make nacho anyway
3024,get excit to see rent tomorrow
3025,alibobali would you like to be the person who ha the 45 second rap solo in the middl
3026,31b4 everyon can see your hous feel awkward now live on post no street view allow
3027,macster7 this a relief hahah tell my grievanc to someon hahah thank for absorb hahah anyway see you in school
3028,wana eat taco anyway im eat green pea with nut crunchcrunch
3029,bigtrock thank for the followfriday love
3030,lmfao there two spider race around my live room ceil mine is call jona and my mum is call bone lol go jona
3031,ahahahaha this is veri funni love it put me in a good mood
3032,play with the grandsjust had instant grit that get everywher it so much fun love it hope everyon is well smile
3033,jesshazel of cours huni anytim
3034,mayb i should stop fall asleep dure the day then i would be abl to fall asleep at night
3035,off to the galapago be back in a week or mayb ill stay with the turtl
3036,therealjordin hahaha for onc there i thought your mom wasnt breath anymor what a nice motherdaught relationship you have
3037,httptwitpiccom69auz garygomus weve save you some
3038,go to work hungov is awesom lol good thing there coffe and swiss roll
3039,elmoss1 have fun im just clean up amp wait for gabe
3040,is thx god httpplurkcompx831
3041,dewdropp lolyour so welcom i will alway be on the side of decad and pleasur unit we stand
3042,ishanibutalia haha have fun in kashmir
3043,just look katti perri sushi nail it funni httpkatyperryblogtumblrcom
3044,wow crest glide is great
3045,go to the quotgirl breakfastquot
3046,go to watch coralin heard great thing about it
3047,i dream of bekahampchrisampswazi ppl last nightalong wprpplampthey all came to my churchampw live togeth
3048,regnisab i dont know im realli not involv with that end of thing if i hear anyth i will post it
3049,positivityblog love your blog one of the few person develop blog ive kept in my feed you might check out abecryst
3050,sau saal jiyo tum jaan meri httpbitlypj27i the love voic of dilraj kaur sound so much like ashaji
3051,followfridaythank ï¿½ stephenwinfield bunkershotgolf golfforum sortagolf divotmonkey andybrowngolf ï¿½ thank guy
3052,eveesantino and im just likeurmmmm
3053,blanquis26 hey there all set for the day have a wonder weekend btw realli work on the pool last night
3054,hang out at the offic this weekend thank to a veri understand wife
3055,barbq tonight idk what el befor that though besid panera breakfast food
3056,rimglob ill let you know if it get pick up
3057,just sit here have fun with my grandma
3058,listen to gregori and the hawk on repeat
3059,dortt you were dortt awesom congratul
3060,yesterday wa all veri fuck today go out with my friend kise colleagu
3061,arthurcvanwyk than i wa rt have u dutch relat amp if that is so 4 how long r u stay in south africa it a small world after all
3062,at gator joe with heather and then movi tonight
3063,and now im eat it
3064,russzart aw thank you
3065,1st day of marathon train is done i had a veri good run and it wa nice to actual have real peopl to run with
3066,now final i am in firsco it wa a hard flight but now i am realli exict realli cool here dont know where to look first
3067,leslegum which is whi i dont tan
3068,good morn everyon my heart is happi and smile this morn i hope your is too
3069,queenofhyp peopl
3070,twelv fifteen tee time i hate golf so were gon na have to spice this up
3071,myria101 i pas the pickl aisleyup i thought of you
3072,today would be a perfect day for a wed happi wed day lifeasjean and ryancmartin
3073,beach with the mel and liz
3074,ha a clutch again
3075,just start today
3076,yawn good morn twitter
3077,singpolyma you should use a real xmpp servic
3078,readingsarah oooh pictur plea
3079,justindalloway what do you think about emili osment
3080,flake86 thank onli 23 more day
3081,young money
3082,itsneet anita hi there hug
3083,nashwoman so when can we see it
3084,sarahboo93 haha i just decid to tri it last night so you probabl know way more than me are you come home for the summer
3085,whoaitsjess ah i love that songg
3086,sakuratbh i saw it it great im read the book
3087,thï¿½i t i ng chï¿½c c nhï¿½ ng ngon
3088,itsneet nico is still irrit hehe we just got ta keep calm and smooth
3089,esmecullen800 im good how are you
3090,ltmake sure u tune in and watch my dun dun show antoniacartersh a fckin movi lol
3091,chancesecond make a fan page
3092,everybodi should come out to drink today to drink
3093,yarn arriv for vivian colour not a expect by still love a dark duski pinkpal wine
3094,jenniholbrook it would have to be a tt then probabl but id definit buy it
3095,lbcisland that alway a possibl im no mp actual a fulltim soldier parttim local cop just a pastim realli
3096,ditaxdeath and i post back
3097,awaint 10 to but some blink 182 ticket normali i wouldnt be up this earlybut anyth for concert ticket
3098,rebeccajudd bless her alot of peopl think she did 4 vote god sake shes 10 ehm diverst flawless or aidan hope susan dusnt win x
3099,bananza it the weekend think about exerc later
3100,tsimitaki yes cybi u can
3101,wooohooo got ticket fo sho to the blink show so stoke best birthday ever
3102,if your wit doubl s bring sum grub n a grill if you aint bugger off
3103,the gymnast fb httpyfrogcom17p8lj
3104,kennyj88 from ottawa to toronto it 6 hrsit not that badand ottawa to montreal is 2hrssmart americanmost ppl don even know that
3105,jpsale good luck and dont forget the ring
3106,offici made a profit yesterday a whole 115
3107,mandybooklov thankyou you made her day
3108,new video up
3109,rachaelblog you polish off a bottl alreadi
3110,mm mm mm so fresh amp so clean from the top of my head to the toe im on my way to corney amp barrow now for reach for sound check xx
3111,ok probabl should get start on today i still have to buy gift for the parti im attend oi vey
3112,naimahkinz whi thank you darl
3113,breadstix oh 7am that head mah way in 15hrs oh god coffe tea crisp n rice so fed make u skinni 2 huh
3114,the goal of our program is to prepar student for job that dont yet exist httpcmsmitedu jaim ï¿½a
3115,i have the worst tan line haha gon na have lunch with nikki guhreat
3116,notapretend ive not even watch an episod just clip of the humanfail
3117,rebeccashear u should particip on bgt ur better than the other competitor
3118,undagroundmilli that pretti cool
3119,hussam harvest of the day
3120,itszikki lol you would how you get that job again
3121,ive had a good day
3122,quotit onli take one person to retweet itquot httpbitlypdwh7
3123,first time out and about sinc my appendectomyrun a few errand and go to a babi shower
3124,oxofamilydad i can tell your from a thespian background ruthless the lot of you
3125,eddyizm one of my favorit song
3126,im in love with the redesign of my favorit museum
3127,richardepryor come share ma pop corn
3128,jona brother i love u in your next tour plea come to venezuela
3129,matrob991 save me some plea
3130,justinmgaston wooo ninja rock
3131,pembsdav greeneyes1966 total i near fell of the chair laugh well done michell
3132,watch bgt the irish danc is flood back to me i may even attempt a wee jig in the live room
3133,mrnico im here n tell soccerjunki to add me bcuz i wa one of the first to say yes to her bein accept in tfc
3134,i cut my hair realli realli short the result is a bit strang but awesom i kiff xd
3135,jontran pink lemonad for the win
3136,sebastiaan klopt
3137,aniqax cant wait to see diver perform
3138,vergil66 i cant believ that im almost tempt to tri it myself id probabl have to get new shoe though i onli own chuck
3139,kielysworld pain is apart of the heal proccess the pain will help you grow into a stronger person
3140,ultimusomnium it wa great thank you veri much
3141,read up on bodybuildingcomso much more to learn hope everyon a wonder saturday paramoreno doubt concert tonight
3142,nyneofuturist thinkin bout it ive got a friend in town and need to check with him first
3143,no work today tomorrow call in 3
3144,eatin with my famili
3145,menace718bk hahahahathat wasnt me be mean
3146,up til 7 am talk to casey it wa perfect
3147,good day out with my parent woo hoo epic chine and an amaz time out with my littl brother
3148,eat some yogurt mix with mango yumm the jesus life is da best p shia labeouf is a hotti amp soz chris brown
3149,clean ugh in a sombrero now that excit right there
3150,diver this is what i have been wait for bgt
3151,diver oooh yes xxx
3152,gerryc hope my work buddi will test that when it releas
3153,go to the cub game on a beauuuti afternoon for basebal
3154,just got back from seein quotdrag me to hellgtquot it wa pretti cool love samn raimi had an armi of dark feel to it seen preview for hbp
3155,tri to make friend on twitter
3156,xohpan eat chocol or just talk with your friend
3157,becksterbreen oh good good i wa hope it would be i need the chem revis time and no ive actual done noth y
3158,love the go pas unlimit caltrain for free
3159,watch bulki amp shirtless savag fight quotth scorpion kingquot on tv
3160,asinisterduck i will join dunno if you ad me
3161,dot12b i absolut agre with you love both act
3162,rachmurrayx lolz i need to get money have none atm if i can get some we should go on monday
3163,just score a 70 prefe ticket for elton john amp billi joel tonight 95 total ticket much better than 300
3164,mall or outsid or someth idk whatev happen happen
3165,sunburnt to fuck
3166,markpappalardo that would be the easi way out
3167,now that i have a smart phone mayb ill tweet more often
3168,keirikyoki hahahaha yea i rememb that
3169,stand in the rain
3170,serryberri niiiic 2 hour last night huh
3171,still need to find out the code to get into the outdoor pool which is final done head to the store to get sandwich stuff 4 lunch
3172,flxflcs043 what are you do tomorrow would you want to do starbuck consid you work there
3173,thetechnewsblog my laptop second is my 1st gen touch
3174,we didnt get home though until near midnight so i went straight to bed
3175,httptrimmux9 ï¿½ denius not belong here telmo a remix
3176,gleea i hate the game play too that is whi i never thought i would be good at youth ministri
3177,drive the pregnant guppi to get dirt
3178,go to kenni hous with twinnielt3 win
3179,i love babi seal
3180,givemebargain were not talk rain here were talk torrent
3181,jonasbroth listen to flywithm on repeattt
3182,lyonstal la la la im sing with you
3183,jshe i like your new avatar
3184,is watch harri potter movi with her nephew patricki think we have watch them all twice now lol
3185,log off ladi will be back for that masstweet session
3186,i hate sleep in thank god were leav soon seattl here we come
3187,talnet show tonight at my church not sure how it a fundrais
3188,sister is here in fl now
3189,blak4ev goood oo good for youand yea she did her origin song ill tell you if she win or win
3190,on my way to the v to see ma fam bamtryna stay busydoin good 2day
3191,head southbound to milton keyn ucoh blueprint tonight
3192,wendy1066 thank for the offer love i may take you up on that one day
3193,purchas ticket for aladdin all for the baddi benefit gray obrien
3194,sit at home
3195,jakobd muhaha du hast echt pech
3196,goforyourdream it ha been a long time come hors have not race for 2 year come into their peak so hope will win some race
3197,whoop i pick the winner
3198,off to the mall
3199,good music 2listen to while think imogen heap she ha such great style a well her voic just put you in the mood 2dream
3200,ha sammi over after be gone for like ever tbh twitter gay facebook
3201,tristanhuwjon final got to read tmnt 56 great job on the stori harmon artwork definit complement your style of storytel
3202,i dont need no good advic im alreadyyyy wastedgirlsaloud 3dayz
3203,suesshirtshop how everyth go
3204,amberbenson awesomewhat did you tell her no
3205,cant wait for wednesday or thursday
3206,rawdawgbuffalo sound good big bro save me some of everyth that not pork or beef
3207,sullenriot get on msn fathead
3208,jaecka im feel dirti for look at them for this long lol but yes pay more to get so much le fabric seem odd
3209,goin out with my friend
3210,enjoy a quiet saturday afternoon
3211,terez07 i am right there with you i realli wish i had some ice cream right now httptwittercomterez07status1975059961
3212,philgerb i am happi to hear that all is well a for me i can not complain life is good got my health and a roof over my head
3213,petermensink look good say hi to the parent for me
3214,so glad the day is over excit for tonight
3215,this weekend ha actual been the funniest in a while saw a neil from inbetween lookalik today he wa so cool gave u the y
3216,so happi for diver they deserv to win
3217,drink tea and watch tv
3218,back from a fantast birthday gather in hyde park full of sunshin fantast food and pure glee awesom friend are awesom
3219,jakewalden yes that would be realli great you and matt alber perform togeth
3220,onc again anoth crush on diem i think shes a cuti
3221,cazl then put your foot up and relax xx
3222,digitalpens sure appreci you post the link to the easytweetprofit quotfin printquot thank
3223,fjkeogh hahaha that is shazi my best mate
3224,drunkenmonkey87 alo vera gel from the fridg is the best make sure you drink enough water
3225,dang how do i feel about meet will ferrel coolll
3226,loveloveshin i like the way you look with glass
3227,gangsti it all good thank you thank you oh if you wan na hear some i can send you it it ok aiight
3228,lonelycoo omg meanwhil i stole your yt vid on fb
3229,johnamussen ion sky never did anth for me must be a boy thing wonder where she is today
3230,gratianb i havent watch da vinci coe and xd we wa lautght in the film but actual there wasnt thing to laugh
3231,skylinesourc awwwwyour so sweet
3232,back from the cricket now have a late dinner whilst watch hero s2 hope everyon el had a good day london tomorrow
3233,allhous fan is on window open way to hot upstair make some browni and danc around to music night of fun
3234,winterfreeze179 nice real smart lol
3235,now it time for my beauti sleep i hope i dont loo ani followersbut i wont be surpris am greatful to the peopl who follow me
3236,rosiegyo httptwitpiccom6acm2 ooooo yay new makeup i love that cute lil bag
3237,mtrico it seem you were at shake shack around the same time a me
3238,kirstyfionagh random follow your tweet where cool
3239,thebagladi now i want oliv garden whi do i alway forget about it
3240,quotif u seek amyquot final make sen to meim so slow
3241,so happi
3242,that last hour went veeryyi quick
3243,heeyyy all thank for your vote at httpwwwhottweeterscomcuterain i am veri happi to have your support kiss cute rain
3244,cityraintun im dig through the cd collect for some now
3245,wingsgrow bummer well yeah chat whenev when you get home then
3246,jeffhardybrand hope your have a good saturday jeff
3247,just met my neighbor cindi who told me that i have a small rhubarb garden and it readi to pick strawberryrhubarb pieoh yah yum
3248,so when im a choir director show choir is definit happen
3249,morimoto for dinner happi birthday mommi lt3
3250,what a beauti day to tie the knot despit the heat congratul chelsea and jarad bean
3251,moreeeee train
3252,just got done with eat a whole chickkeeennn
3253,i love warm day like this especi for lay out dinner blockbust movi night with wifey such a good day
3254,and now we are in wyom by the way tc final agre to think about name one of our kid that
3255,mrsjackbauer7 haha omg it work now final
3256,i give up on grad workbut i do love googl httpgooglereaderblogspotcom what will they think up next tedu560
3257,whi is comfort food alway bad for my health had the avocado bacon cheeseburg anyway to help concentr
3258,mvanduyn are you come to their show in orlando fl at the social
3259,gtowna i am read never eat alon now
3260,jsusgrl most porbabl bb
3261,ithildyn it been sinc april 19th and i go back on 27june so yup
3262,go to see up tonight yay i love movi night with the boytoy lt3
3263,caangel sound yummi
3264,ahhh you know it go to be a good day when you arent nurs a hangov
3265,head outsid with the youngest kid for our night walk about the garden then back insid to work on the book
3266,httptwitpiccom6ant0 guess who is whoooo ahahaha
3267,bayoubengal56 i am not but i am sure my dad and sister are
3268,omfg my phone crash fml serious
3269,zivklara aww that horribl oo when do you have your day off school then what exam is it you got ta studi for wish you good luck
3270,d0opeb0ii sad you may be right
3271,boooooooor but not in 5 min
3272,uncletreypound yea i dont think so
3273,guttabutta im have this debat with my friend now she said that too
3274,watch night at the museum 2
3275,emfk bug you got ta love them hope it will get sort asap
3276,at dinner room with my new quotfamilyquot lucia my new si is come to the dinner actual shes here
3277,shilo cripe bar amp grill in ligoni start at nine come out
3278,spent the day in bed pas out on back pain med feel a bit better tonight wellrest anyway
3279,youcancallmejuu what are u gon na watch
3280,live2dance84 that the spirit
3281,my new bluetooth headset came via fedex today yay go jawbon
3282,shoffnert judi work out with brandon hahahahaha httptwitpiccom6ar6m
3283,stephkat noppe you should get it for her
3284,dancer danc teacher amp danc studio owner how can i help you
3285,manderley wonder if your brother also ha dimpl
3286,irishlad585 they r have fun weve spent most of the day outsid i bribe them with ice cream to clean the bedroom
3287,sworn off school work go to make some music today
3288,nguyen ive still got a jornada should we start a museum
3289,albynomonk hi how are you soren
3290,craig10tv aww how cute
3291,twimom317 wow faint
3292,ashleytaylorx3 shellbee123 ohhhh no i forgot beaflutei im sowwi boo i love you too
3293,mm mushroom lasagna it remind me of tao in new mexico good memori
3294,letsgetthisgirl damn girl i wish i could follow nkotb like you are cant wait to hear all about itim in toronto see you june 21st
3295,mackyrosman im gooodd sorri you fell lol i do that alot i miss 7th heaveeen
3296,robynz veri interest but how do you know what your number is i alway thought my number wa 3 caus my bday is 21674 confus
3297,fell asleep in the sun today now i have a red n a white side of me the nice weather tomorrow should fix the multicolour
3298,jckcrealti how doe the travel voucher site work jckrealti if you dont mind share
3299,pcvmakeupjunki you are gon na stop by later right
3300,just finish a makeshift photoshoot dog wa act crazyy let go orlando magic
3301,kyra and i are hang out with an eight year old girl tonight glitter paint fb
3302,yeaaahhh diver won britain got talent d they were amaz 2nite xxx
3303,the new album drop soonyou better be get excit
3304,stay focus do not lose it
3305,alexaara whi would you say that you cant stop eat regina it too amaz
3306,cate1987 converg without notic and you might find the manboob in your luggag when you get home
3307,quot of the day quotwalk soft and carri a big magnifi glassquot richard lacayo
3308,bxcutestangel awww sorri angel but mayb it will happen next year
3309,china child in poor rural area with happi smili face xinwen lianbo oo
3310,drove past the hous todaysold sign is offici up 12 day until settlement and 26 until i move cant wait
3311,renehdz18 thank
3312,ariel grandma hous is beauti i love grad parti cuz all the fooood there guacamol yeahh
3313,zomg i just figur out i can final upgrad my phone to the iphon im excit now anyon el use the term zomg repli with zomg
3314,thefairest aww dont hurt me lol and wow are they done alreadi i love yellow rice send me a pic of the dish
3315,3 hour of chillin wit her the bestest lol idk but im im even more blown away lol lmao jk
3316,oe crm como ï¿½ perder pro the big brain haha
3317,nezua im do much better now still have a sore throat but everyth el is great wut u do 2nite
3318,tluckow lol i knew you would approv
3319,time to backup my comput back up your too while im do mine
3320,bethofalltrad httptwitpiccom69bs9 happi birthday
3321,moondancek glad to know you both surviv jojo got a bit piss eh
3322,disgustedcat good
3323,httptwitpiccom6b26n i got these in the mail today
3324,erbo08 no tweet deck ela n aparec gtgt wwwtweetdeckcom
3325,beckyingj what advic is the great and wise pittypat offer up tonight tell her hi btw
3326,twitter go up and down im get dizzi
3327,donniewahlberg hey ddub
3328,yayi my fave cousin came to visit me in nyc
3329,tommcfli we have some kickass beach here in venezuela cmon fletcher you all have so much fan here
3330,im sick and tire of twitter becaus of so mani outag but i love twitter it like a love and hate relationship lol
3331,dinner at the cheesecak factori yummi def treat myself to a browni sunda
3332,about to head over to muvico with nabilismfof
3333,disneyfan10101 lol that awesom
3334,sexi costum sexi lingeri sexi leather and so much more we are not sell church out fit here drive him wildhttpbitlyhedpd
3335,i could use some comment love all i am new to the blog world httptheleonardsfamilyblogspotcom mmwant
3336,jus found out sum great news all imma say is i cant wait til 4the bet award
3337,yay shoppp
3338,maneat is hyster
3339,had a fanast day love goin to see cast crown and then the ranger game with my church tomorow is gon na be even better
3340,up wa supercut
3341,am i in a movi this sure feel like it
3342,we got our denali
3343,watch movi all night whoaaaaaa
3344,best part about magfestti evan sulli and the monkey when did it get so lame lol at taco casa with beth diet coke
3345,myinnervixen of cours we did
3346,jeremypow great job jelli belli good to see brad up on the top step again
3347,candygirl523 hey did ani of those pant fit you or your sister i hope they werent too ugli
3348,im a wittl hungri gon na have a good snack and protein shake
3349,squirrelrehab with the crazi weather we have here in the midwest a blizzard would not be out of the ordinari
3350,jennypoussin that caus your sexi self just to hot for facebook to contain
3351,i bought glass today for the first time is eight year the lasik wore off and old age ha taken hold
3352,yeahhh orlando amp naw laker wont stop them either via nba on httpwwwtnttvsportsnbaplayoffs09
3353,say stop wait for someth to happen take action and make anyth happen httpplurkcompxankw
3354,hockeyvampiress theyr air the last 3 episod
3355,just play rock band now get get readi to go to the lake with the girl
3356,conartist4 muahaha i win we need to go to montrï¿½al and have offici poutin lol hmm poutin
3357,on the trampolin with bj
3358,magic won magic won whooohhaa howard your the man
3359,im glad rpattz fan are dig out more info i wa a lil worri that i woudnt get my daili dose of rob
3360,club time my name is adamadam rowland nice to meet you
3361,im so addic to twitter mom just left to go to a special event her friend is host home alon
3362,hang with the gir miss this
3363,watch the nanni
3364,httptwitpiccom6b6x1 1000 island conserv zone this wa part of my saturday
3365,anoth breezi beauti day on maui httptwitpiccom6b6x8
3366,bueno ya me voytomorrow earli for the beach good night
3367,duloc is a perfect place plea stay off of the grass shine your shoe wipe yourfac duloc is duloc is duloc is a perfect place haha
3368,beauti day outsid im go to uni then to workshop for blogger delight
3369,i just got home from a fun lolita meetup thank to everyon who came
3370,aj colbi wkyctv cleveland is the heir to tom skill p dear cav you piss me off but i still love you have fun in ny lebron
3371,is hungri watch tv with mommi in her room
3372,i lt3 memori foam
3373,georg baker select ï¿½ littl green bag hey there jdsrecordshop httpblipfm7ct4c
3374,hope la absolut crush orlando cant believ it not a lebron v kobe matchup peev
3375,smithcnn are there ani cobbleston along the giro cours todayif so the rain could make for fall hope your wife is enjoy today
3376,quotdaddyquot bought me an air condition
3377,disciplesix ooh how show me
3378,is search someon who care with me
3379,happi birthday dad
3380,awww laker amp magic yayyyi dwight
3381,jonasbroth your my angel
3382,kenichan i want to
3383,teddymasika im gon na do it babe goin 2 shake my bunn amp have a ton of funn lmao
3384,pittpantherell look like youv got the hang of it to me
3385,logictrain you might like some wall decal for your nurseri but wait for paint to fulli dri httpwwwcuteybabycom
