,message to examine
6316,is think about pierc the othersid of her lip yes that bore i want a snakebit pierc anyway im alreadi halfway there
6317,begin a sermon seri in leviticus tomorrow yep that right leviticus
6318,quietkarma if my heart wa an instrument it would be a piano wish id learnt to play it proper when i had the chanc
6319,just left my nephew bday parti on our way to temecula wine festiv to hook up with some friend care to join u
6320,cabofishtaco it free whi not
6321,rosasyummyyum okgot it now
6322,im so thank that r scobl invent quotreal time webquot im joshin unless he actual did re httpffim3fw5t
6323,earl wear a tie
6324,jonasbroth sound awesom i hope your have fun and i cant wait to see it good luck with the rest of rehears
6325,jonasbroth yay im soo excit for the concert and im happi that ure youtub account is back
6326,ok so my final grade in histori is a b good despit the horribl test grade i manag
6327,skaterday aww you should have come with u guess you were suffer from internet withdraw
6328,i found some fun for the even
6329,mmkrill bring back memori
6330,the7thpwr ani of my shooter song show waylon boy like those to
6331,had a veri hard day hope 2morrow would be okay
6332,i am back i wasnt allow to tweet for a week but now im on tweet me
6333,my girlfriend is amazinggg she make errrth better becca jean lewi iloveyou
6334,bean encount tonit thank you shot of the week
6335,wow tonight is gon na be one hell of a night fuck ya bring it on
6336,jadelinaa you know it hard out here for a pimp
6337,vievee hahaha i think i just might ive been home all day but i wan na finish clean first so ill bbm you
6338,tooshort55 lol wthwas he do that for i wonder that is too funni they are so silli
6339,lancearmstrong my car die 2 year ago now and i never bought anoth one i walk amp bike ride everywher best thing 2 happen 2 me
6340,if i had a pas life it would be a queen or princess or someth sometim i wake up at night and say damn it where my servant ha
6341,im bore gon na paint my nail and then watch drive lesson in bed
6342,pulpjedi we have ton of newspap but if you want to bring some too
6343,just watch kati and peter statesid it is my guilti pleasur i love them
6344,battleborn ill email you the recip you can do it
6345,roast marshmellow
6346,aplusk that old ha
6347,last minut wine chang we ran out of the david bruce so we are substitut the 2006 ancien pinot noir from russian river same price
6348,hyunaepark lol girl what r u doin hahaha floodin twitter dude it been work day from hell whatchu doin tonight
6349,starshipm thank kekek
6350,just bought kite and a new pole
6351,gon na eat a blueberri muffin
6352,gratzer94 when i saw thirdday in south bend i had them autograph my revel cd that i dont worri about lol
6353,britneyxsuck hahha mexican are cool
6354,root chakra tonit w jeremiah ravi saqi meadowmorphosi etc
6355,a soon a i get my hand on a scanner there are at least 3 peopl that should be prepar to go backway back 1998 wa quit a year
6356,there are so mani puppi be walk along the boardwalk and my cousin ian must pet each one he 23
6357,lambonfir god is watch
6358,make a present
6359,40 okay realli the penguin must so be humili
6360,gotlove4dc3 jk wit ur ratchet as i forgot u gt defens easi and uh ive gt my man jst lookin 4 the other half
6361,had an awsom night with the girlfriend movi wa dumb but it wa fun
6362,on my way to la 2 the roxi carmen electra will b there and i will get a pictur it my mission
6363,davidarchi woot woot knock em dead david
6364,i spent most of the day do noth it felt great mama brought me pollo loco and now im so full i can take a nap im so lazi
6365,hmmmmwhat are you doingim sing a veri awesom song and ima go see a movi calledtermin salvat oh yea bitch xd
6366,bdcrawford hey grandma again congrat
6367,had a great time at the celeb softbal game with mila and sarah at coney island today sarah team won bla bla whateverlol go code blue
6368,i am natur myselfc tell by my pic though i love be natur shesouldeep
6369,eat at houston yummi then prom amp hope get to see someon tonight
6370,hangin out with my famili
6371,comeagainjen jenn i just want to say that i think that your so beauti ugh i serious love you lt3
6372,httptwitpiccom6sqz5 me and marisa after promotionnot sure who took it but i love it
6373,oh how i love pink lemonad
6374,the night is so aliv and so am i feel you know
6375,kaylamaynard alright thengetcha drunk as on overr hurr
6376,the hangov wa one of the funniest effin movi i have ever seen and bradley cooper hot
6377,tam16943 it a show
6378,im feelin better now
6379,hello first place welcom to boston babyy lt3
6380,writethevis hey adrienn i hope u amp ur si had qualiti time yesterday read my sign copi of quotbreakthroughquot asap
6381,my858realtor cute pic
6382,hannahbanana25 it be hella good too and im notcant drink now
6383,fifa final usa win 21
6384,just watch last week sytycd their bodi are amazinglik whoa now were watch full hous
6385,445am here im off to bed
6386,amaz time with my best friend tonight i realli truley see whi we are best friend everytim hang outlt3
6387,readi to get off and partay
6388,xat own
6389,owl311 gracia amigo it is good to be back i am now sunburn and probabl will have skin cancer by next june howev
6390,cool even white wine homemad cheesi potato hbo and clean laundri mmmmmparadiseor at least better than monday thru friday
6391,good morn im up earli it sunday today ill just probabl stay at home and twitter heheh
6392,pretti much over the jetlag now enjoy have stepdaught and her boyfriend visit bbq and pool day tomorrow nice
6393,just came home from a nice cook out type parti lol mad funnn nick your mine
6394,im enjoy collect all these demo version of the song from brandi album
6395,shakeuptheworld hey
6396,gronar i like be pleasant surpris by movi it wa perfect for my lazi saturday afternoon
6397,i am home from work drink coffe
6398,they have the best soundtrack for these freakshow
6399,mileycyrus there is alway a rainbow after the storm
6400,just got done shop with andrew for dinner stuff we clean hous all day so movi night my best friend girl
6401,had an amaz day seaworld bbq my hous
6402,bought two pair of skinni jean one for 6 dollar and one for 10 dollar and then bought more stuff from victoria secret
6403,make good thing come togeth behind the scene feel good ill share about it one day if it pan out of cours
6404,toni and ethan rape my screen it great
6405,williambason ajhic im lucki to have such great friend that would drive 7 hour each way just to watch me raceawesom thank guy
6406,ddlovato im soo excit for you lol i know it go to be great
6407,doombox it wa funni sooki laugh too and bill gave the best look it curl my toe he smexi
6408,enjoy attend a bbq with friend on this nice summer even even better eric wa abl to attend with me
6409,jumblejim tri to do more later and also a bobbi toon lolhttpourspnpixnetnetblogpost28142273 come visit u
6410,jordanknight i like her think
6411,hee hee final got a chanc to see the episod of quotwak the deadquot that my bro wa in
6412,make popcorn
6413,iamsummerz ê³µê°ìš ”
6414,at in and out with sarah
6415,emzanotti lol youv crack the code you may onli get a few game out of that strategi though keep chang it up
6416,viktorialov how nice i like girl with pretti toe and nail
6417,wonder whi the heck did i get a twitter if i neverrr use it lol bout to use it more often im on the guitar txt it
6418,kiairaest1989 lol crazi hope i make it down there so we can go out be club junki like 1st semest lol good thimesssss
6419,mama hahai need the mani
6420,denifti that is what i wa just think it would ea my conscious for not get the deal done good think list my fav spot
6421,great day goodnight
6422,shannonweiley hi shannon movi are unrel to raw actual plea go to httpwwwbarufilmscom for more info about my film
6423,tiffanyschmidt hehe blame away new wip ftw
6424,poetjanetdawson like your name chang not sure stomach ha been bother me all day bleh
6425,had the best time at dana birthday parti
6426,loveleelov if i did it would be my pleasur i live in philli just hate the laker
6427,yeah mr rain final paid a visit it so much cooler now
6428,im so exhaust well the b shower wa amaz and now it time to parti hous parti yay
6429,alyandaj i total agre best movi ever
6430,homeexhaustedrid bus tomorrowso i better go read my bibl and go to bed
6431,suziiebe oh i see lol yup my turn nukka readi to go to the ghetto of orang counti x santaana babiiiiiii
6432,top10caus
6433,bloodcicl use freeballin in a haiku plea
6434,dinner on a rooftop garden with a view of the sun set on mexico citi also sushi and drink veri nice
6435,waterprotein i lt3 your icon especi bulleto lt3lt3
6436,michaelcera superbad 2 would be so freak greatlov the first one
6437,cbclick do it happi atamptbold user here
6438,memori from last nite are all happi
6439,katieseymour ill be in seattl tonight it would be cool to bump into you havent seen you in a while
6440,jinnah oh that someth you can work around you dont have to associ with everyon just imagin them in their underwear
6441,beartwinsmom goodnight i wa good to get to tweet with you again
6442,good snack cfsmtb better to burn em off the next day on a bicycl ride
6443,alidaley sound love hope the rest of your weekend is a realli great one and that you are spoil a littl more
6444,nel1jack that video is no longer avail
6445,want to advertis on my new site 5 promo code a week that it
6446,lynel glass of wine might help
6447,volvox23 i had charli chan calzon potato halv amp 4season frm yellow cab lumpia salmon belli strip
6448,whew what a crazi day tomorrow should be fun relax on the reservoir
6449,yelyahwilliam last night i dream i meet you i hope it gon na be true plea come to indonesia plea
6450,pinkissopretty5 yeah i have like 2 or 3 more quarter to go stori is a bit long for twitter facebook me for detail
6451,thebeerwench im smoke a fabul maduro right now and drink a fabul ten fidi with it
6452,home from a veri fun night with some great friend i have known my whole life d good time
6453,queenrosi thank you i had a tuna cake with a bit of catnip on the top so yummi
6454,beliria vinworldwid hello friend hope you are have a woder weekend
6455,me and best friend r readi for tonight uhuuuuuuuu hope someth good will happen
6456,parti at adrian
6457,gottarambl hahahaha the choc fountain bj gave it to me and she doesnt know ileft it in your hous just bring it ovum
6458,shamim86 i dont doubt it yeah gig wa real good out in the sydney suburb wa fun
6459,amaz fun time i love you guy
6460,ive been think mayb i should go to sleep soon
6461,na fuck this imma parti like a mother fucker parti in my room wit my si
6462,lookin forward to the dauphinã© libã©rã© go teamastana
6463,and i wa the sober one and have more fun than anyon that how i roll life of the parti style
6464,pubbi go to see bill bailey in august
6465,ricacupcak i didnt see it lol it wa sold out but i ate at pink taco
6466,itsd wut u tryna say lol every1 shud be happi after they get out the shower
6467,myke329 haaaa that goe down in the list of best thing youv ever said to me lol thank mike
6468,missshellbell heeeeeeeey your still out there good to hear from ya im do wellstil jobhunt though
6469,forensicmama nomine are out on the 16th i hope the peopl over at the emmi have sen this year
6470,tmatzner the rodchenko inspir web design just shout quotrevolutionquot to me
6471,desireeeee realli me to
6472,do you like y eat or keat better i like keat about total lap him up or ate him up i should say haha no joke
6473,watch up again with my brother lmao i looov this movi
6474,mahmoudm94 im gon na give you candi
6475,missmillion yes it a beauti sunday over here
6476,amup got sim 3 yet i do it rock
6477,kchenoweth oooth music hair i wan na watch that i just cantboohop i could watch it when i go to new york
6478,rcradio live guest im there yet again
6479,play the wsop ladi event tomorrow ill let ya know how it goe
6480,filmspot welcom back to iowa
6481,drove around all night fat cop follow u the whole time ahhhmayzin
6482,gfalcone601 mooorn gio have a good trip i hope to stop rain
6483,about to sleep soon
6484,bout to make a track wid the cuzin nikko watch out bet imma be on my way lol imma beast
6485,hangov is popular work is crazi and fun love free movi
6486,cineri geezus okay that funni ill mind my own busi from now on ill be sleep in the corner if you need me
6487,collierchin sweet ill tweet when i head over hope your recov by then
6488,last day in work for 8 day
6489,taylorswift13 im watch you on csi now babi
6490,kyujaemin coughcough still on season one oo heehe i start two day ago onli
6491,beardoctor tnx you so much to you too if i block those louse will they be gone thank a lot my beardoctor friend
6492,thebeth thank have fun
6493,loveyea i feel your pain ive been there date that amp surviv truth u need to do what she sayin it will be better on the other side
6494,gabbemceefli hope you have a heap good time bub
6495,i intend to live forev so far so good
6496,synterra thank for follow
6497,bun venit cursuriafaceri pe twitter
6498,morn all and a big shout out to the team at gchq in case theyr listen
6499,hey it been a while just updat mywebsit
6500,death616 goodnight
6501,the princess home goonightmorn b safegood amp i hope all ur even were enjoy amp well spent
6502,just saw hangov funniest movi i have seen in awhil high recommen
6503,schadr get 100 follow a day use wwwtweeteraddercom onc you add everyon you are on the train or pay vip
6504,rank up yeah you guy got pwnd
6505,pixel8t thing move quick in the twittervers httpisgdrhh ycm quick becam a team effort fridley glebe2037
6506,im go to take my contact out and onc i have annoy plasticfram glass on ill want to go to bed to get them off my face
6507,hana77 heavi rain in bedok south just subsid sun slowli come out to play
6508,youngq my hand up here i love it too
6509,youngq i have made sever close friend becaus of nkotb it a beauti thing
6510,natashaloh talk to you when i get back k hug at pedder red now beam
6511,djspinner thank for the encourag
6512,likesunday sorri at least a netbook is the cheaper rout you can also take ur netbook to an appl store and use their wifi
6513,great to be on board portraitgirl ur welcom debbi lameymacdonald will do boydgreeneart
6514,proud of myself wrote and referenc my 1st song 4 an actual artist my 1st of quotprayfullyquot mani thank god
6515,wow i found all of brennan messag save in a word document theyr so sweet i love him so much
6516,he dope lol
6517,lindutt tabor goe to heaven look interest a doe turkish gambit lot of russian movi to explor
6518,off to gh to meet up soodugyot shawarma time
6519,fireproof yall
6520,jordanknight too earli for cheerio still sleepi time
6521,trishababbitt i blog a neilhimself quothey girlquot photo on bustcom you prob can find it if you googl quotfuck yeah neil gaimanquot
6522,alexandramus beyonc doe the birdi song httpbitly5annn i thought you might enjoy this
6523,vanessaahudgen your nice to your mom i cant do that
6524,for with god noth shall be imposs luke 137 one everybodi should know
6525,shackd get 100 follow a day use wwwtweeteraddercom onc you add everyon you are on the train or pay vip
6526,therealkashflow bro gettn his freak on hehe
6527,celinexcullen hey
6528,this night shouldnt end
6529,verysmallghost ð¼ðµð½ñ ð² ñ‚ð¾ñ‚ ð¼ð¾ð¼ðµð½ñ‚ ðºð¾ñ€ð¼ð¸ð » ð¸ ð¸ ð½ðµ ð¾ñ‚ð¿ñƒñðºð°ð » ð¸ ñ€ð¾ð´ññ‚ð²ðµð½ð½ð¸ðºð¸ ñ ñ‚ð¾ð » ñœðºð¾ ðº 9 ñ‡ñ‚ð¾ ð » ð¸ ð¿ñ€ð¸ðµñ…ð°ð » ð° ðµñð » ð¸ ð½ðµ ð¿ð¾ð·ð¶ðµ
6530,chacallachais dank
6531,nicolevsanchez sound like fun have a wonder day
6532,yay i got a pt on my scholar
6533,danrua get 100 follow a day use wwwtweeteraddercom onc you add everyon you are on the train or pay vip
6534,not do much just join twitter follow me if you want ill promis itll be fun luv you lot shout out to all dc
6535,itsyaboytr i wa just statin fact
6536,wsamuel get 100 follow a day use wwwtweeteraddercom onc you add everyon you are on the train or pay vip
6537,jawslyn butterynippl thank babe for the concern me feel love ill be go for a scan for my heart hope it ok
6538,cant sleepback to work
6539,cynthiaburough hug bk
6540,jonasbroth heck to the yes lt333
6541,daydreamer092 great im sorri im not familiar with clannadtt but is there other anim song you like or enjoy listen
6542,good night all this wooki is retir for the even yyaaaawwwwnnnn sstttrreeeeetttccchhhhh
6543,this day and age how ive miss you
6544,wooo hooooo golden tequila rock n so doe amrutanj
6545,nursharina get 100 follow a day use wwwtweeteraddercom onc you add everyon you are on the train or pay vip
6546,sunday is start well i have a chalic of coffe and a bad detect drama on tv
6547,hope she doe well at shoot today finger cross and is look forward to see her ameypi
6548,phantompen yah weird real glad your back now stay
6549,so im gon na take my dog for walki and do my math note while watch the curious case of benjamin button excit brb
6550,realhatt shes on vacat
6551,pierc the tongu i wonder what next
6552,goodnight yall know i dont sleepi pull all nighterswrit songsamp think of new way to annihil amp embarrass my oppon
6553,daverama dave is that you httptwittercomdaveramastatus2062778060
6554,majornelson be safe over there dont know what i would do without the major
6555,blister hurt bad but it a worth it
6556,thank for follow and support jb tell your jona friend to follow u
6557,all famous peopl were peopl onc their be public properti is a new develop this is a note to self too
6558,jaychasm i wish i wa there with you niggi gnite luv
6559,snowleopardess had to give him a good rub down with a towel and a quick back scratch brush follow by some doggi treat biscuit
6560,diamondgirl haha love you swine did you like that lt3
6561,mmm roast pork wa yummmyy
6562,just woke up
6563,ughh i have the stupid hiccup watch superbad the pefect end to a great night
6564,twitter like the rest of you bird
6565,is go chingford 2 c aunti and get some jeggin
6566,httptwitpiccom6ti3d this wa taken christma o8 i use to be an angel on the program one pretti angel lol
6567,me and seabee90 are make taco
6568,anastasialoxley hahadont worri i just had one too xx
6569,day 62 near 9 week i truli didnt think i would get this far without a relaps onli anoth 45 year or so to go
6570,vishaltom
6571,souljaboytellem you the man dre the swag flu is off the chain for real killin it man my number 1 rapper right now no doubt
6572,is excit becaus it is final sunday and im go to sam and it his birthday on tuesday yayayayayayay
6573,ahem twitter alwi get so busi on saturday night
6574,realbillbailey last night gig wa awesom you rock
6575,4 show speak engag in the next 3 day busi busi busi south bend in clio mi and warren mi here i come
6576,go to httptwitterthreadlesscomuserwesoxfordsubmit to vote for my tweet to be on threadless i could win 500 i will share
6577,jodiej04 id be lie if i said no
6578,i love pinbal wizard i have decid oop i wa meant to be go to bed ay hehe so cheeki not nighti night
6579,mampd in the rain should be fun
6580,thank everyon for suggest re httpelearnrorg will keep it asi for time be amp consid use it for staff cpd at academi
6581,muteboy congrat dude pint are in order
6582,nathangoss should have seen the tree ha no bark left now i got a scratch but next time i see it the tree will be dead ahahhahah
6583,charlene205 you have to watch it i made my boyfriend watch it but at the end he wa like chick flick lol
6584,hey everyon oddmanout75 is look for some great peopl to follow and follow him sinc all of you are awesom you should follow him
6585,joshmacfal hey you i heard the gimp ninja script is great cant wait to see it
6586,amerj thank
6587,nice to work on sunday walang pasok supplier no one bug me
6588,twenty20 tenni f1 wahay thankyou alysd for last night might do a twitpic
6589,first day of school on june 8 09 and that tomorrow man that suck everyth up especi summer thank for the memori though
6590,dannacalynn idk that sound good tho what other movi
6591,ani sunday day of a few friend twitter the day thought sole through ani lyric beginsnow forgiv u anisunday
6592,dalespoonemor that too cute
6593,officialtila hey girl doin big thing got respect for what you do and yous a dime too haha
6594,lindseythefirst unlik zebedeejan who ha is a serial offend
6595,frezn i think you should burrito are win
6596,whi is there a religion exam i doubt jesus care whether or not we actual know anyth about him chisholm is gaayyy then end
6597,im submit my site into directori and also listen to natasha bedingfield un written
6598,cantanta your welcom rosamund pilcher book quotvejen hjemquot is also quit good and realli sweet
6599,i bet that steve job will make a cameo tomorrow through a videoconf with the new iphon video he dicho
6600,great shot good outfit esp the tight are realli cool httplookbooknulook160540
6601,my low blood pressur almost ruin it but i had a looot of fun today
6602,well ill go cook byeby
6603,pack my bag for tomorrow
6604,play the wii and guitar lol and wrks in few hr
6605,now ha a cold face from walkkng to the servo haha oh well the joy of live almost on top of a mountain
6606,weisen hi brian you are welcom yes i am still learn to communicatelifelong learn
6607,go luca amp justin for the win tonight on masterchef
6608,anthonyhil didnt take me on a product editor a not enough experi but ask me to start a an ed assist a they like me
6609,augustweb my pleasur
6610,i love my church
6611,just land home at last cant wait to get back to my bed
6612,i want to have a guitar like taylor swift
6613,moogieredsho hehe i am alway fix mine after mum ha had a fiddl with it lol but i reckon it the onli way to learn how it work
6614,you know what i fuckin love julz will not find no bitch greater then me on some real shit everi othr femal out there is weak a fuck
6615,im eat tum and yes it basic healthi bananaflavor chalk
6616,ha veri sore muscl in place i didnt even know had muscl after yesterday fit challeng i hope everyon is feel ok today
6617,fransiscawinda hey windaa
6618,100 post
6619,ngower crusha raspberri milkshak best drink in the world
6620,head into bow for some dinner
6621,onli just made it befor 3pm friday have you mcvalu lunch this week httpunu7dk9 fb
6622,web20build i high recommend you join wwwm2easia you can earn money from free sharehold by dividend even you do noth
6623,good morn
6624,val hope everyth is go well havent talk to you in a while
6625,lol gordon ramsey is such an idiot
6626,kingstyl but man what a pretti implos it would be
6627,musgravejw the prohibitionist are tasti thank for final post link
6628,off to the hill of eastern kentucki to volunt for a week wont be abl to check my retweet but will tweet from my phone
6629,morn everyon sat with dye in my hair so on here for a nosey 4half hourxx
6630,multipli
6631,cymberrain i wonder what happen to you lol aahhhth sweeeet tast of freedom
6632,griseldalol2009 hey yes i am im from east lothian you know it how is dunde at this time of year
6633,dinorizzo say a prayer for my peopl my whole famili of origin live in itali enjoy and tri to order a tiramisu fun
6634,look at pictur of my friend
6635,thejoyrid and now that song is in everyon head thank a lot have a great trip and be safe and tell the guy hi stuff look great
6636,canteburi multitask rock piti you havent been to the concert yesterday
6637,eleusis7 realli winter is the best time of year
6638,exact sinem exact re httpffim3bv6n
6639,tom watch the grand prix the sunday time and a cinnamon whirl on my lap green tea cool gentl bliss
6640,sn0wrose naha while ago
6641,haydio dang that such a shame
6642,go to eat breakfast with julia
6643,mmitchelldaviss nice to know someon el sleep pattern is a bad a mine
6644,thefeel see you later xx
6645,video on openminded around the fiveminut mark it all start to come togeth quit nice
6646,essay limit 2000 word my count 1999
6647,blowhornoz i have a pc laptop
6648,thehungrycod i had here at nator realli cool shower
6649,had a good time my birthday parti tonight thank everyon
6650,watch hatch pete on disney haha d jasondolley is sooo cute haha
6651,srkneo thaank for follow
6652,ahh i love the vicar of dibley
6653,sockington i dont care what hooman call me a long a it not quotlat for dinnerquot no food i get cranki murder cranki right
6654,jiarhwei daddi bought kfc back
6655,head to ft wayn to drop the kid of with the inlaw for the week
6656,lisalavi too mani to choos from but one of my all time favourit is quotyou are so beautifulquot joe cocker
6657,berkaytascioglu u know u love me
6658,i want to have a good time
6659,mdd360 awww thank
6660,this time of year the sun wake me up loud amp earli it remind me of an eager child readi to start the daybright cheer relentless
6661,judehamilton no problem judewil be a pleasur httpmylocme2ufw
6662,wereuntouch thank youu
6663,httptwitpiccom6to9d keep that in mind
6664,carboncopybib i high recommend you join wwwm2easia you can earn money from free sharehold by dividend even you do noth
6665,quoton those who have learn the power of sincer amp selfless contribut experi life deepest joy true fulfillmentquot toni robbin
6666,pebbl wa afraid of the thunder and lightn this morn we aint had that for year wow new pictur come soon
6667,if onli the left hand talk to the right hand better then this world would be a better place
6668,tannwick year ago circa 1983 there wa actual a hedghog flavour crisp
6669,is wear a sydney tech jumper
6670,anoth long w leilabbcbo and brysobextin23 where the fat hoe at haha
6671,omg mejoeyseyeon and jessica are watch metro station togeth this is gon na be so much fun
6672,had good time at the carniv jami carl lol hahahahha your just jealous of my amaz smelli ball
